{
  "invite_id": "3c4d5e6f-7a8b-4c9d-8e0f-1a2b3c4d5e6f",
  "invite_token": "awm_i_6f1c2a4e-8b3d-4e5f-9a7b-1c2d3e4f5a6b_HCk2Q1BdaneEkZ6ruMXS3-z5BhMgLTpHVGFue4iVoq8",
  "handle": "kit",
  "device_id": "e5f6a7b8-c9d0-4e1f-a2b3-c4d5e6f7a8b9",
  "device_pubkey": "W2h1go-cqbbD0N3q9wQRHis4RVJfbHmGk6CtusfU4e4",
  "join_mac": "Ym98iZajsL3K1-Tx_gsYJTI_TFlmc4CNmqe0wc7b6PU"
}
